{"baseRef":"refs/heads/main","baseSha":"aaaaaaaaaaaaaaaaaaaaaaaaaaaaaaaaaaaaaaaa","effortPolicyVersion":"plugin-compass.effort-policy.v1","exactModel":"gpt-5.6-sol","hostConcurrencyCeiling":2,"integrationBranch":"cb/integration","integrationExpectedSha":"aaaaaaaaaaaaaaaaaaaaaaaaaaaaaaaaaaaaaaaa","mode":"auto","runId":"cb-20260901-0123456789abcdef","schemaVersion":"compass-builder.run-spec.v1","stories":[{"acceptanceChecks":["Alpha unit tests pass."],"ambiguity":"low","completionState":"pending","complexity":"low","dependsOn":[],"description":"Implement the bounded alpha contract and its focused tests.","id":"alpha","independentReviewPath":null,"priority":1,"risk":"low","sharedState":{"description":"No shared runtime state is mutated.","mode":"none"},"title":"Alpha contract","validationCommands":["python -m unittest tests.test_alpha -v"],"validationStrength":"decisive","writeScopes":["src/alpha"]},{"acceptanceChecks":["Beta unit tests pass."],"ambiguity":"medium","completionState":"pending","complexity":"medium","dependsOn":[],"description":"Implement the bounded beta contract and its focused tests.","id":"beta","independentReviewPath":null,"priority":2,"risk":"low","sharedState":{"description":"No shared runtime state is mutated.","mode":"none"},"title":"Beta contract","validationCommands":["python -m unittest tests.test_beta -v"],"validationStrength":"decisive","writeScopes":["src/beta"]}],"userConcurrencyCeiling":2,"validationCommands":["python -m unittest discover -s tests -v"]}
